valve	n.	(活门,阀) device or structure for controlling the flow of a fluid
vanish	v. Syn. disappear	(消失,灭绝) disappear; pass out of sight, especially quickly; die out
vanity	n.	(虚荣,自负) quality or state of being vain; emptiness; feelings of excessive pride; conceit
vapor	n. Syn. gas; steam	(水汽,水蒸气) gas; steam; barely visible or cloudy diffused matter, such as mist or smoke
variable	n. Syn. factor	(变数,变量) factor; something that is likely to vary; changeable; inconstant
variance	n.	(分歧,差异) an event that departs from expectations; the expected value of the square of the deviations of a random variable from its mean value
variant	a.	(不同的,另一种形式的) varying in from, character, or the like; variable; different; diverse.
variation	n. Syn. change; selection; deviation	(变异,变种) act of changing or altering
varied	a. Syn. differed; diversified; various	(杂色的,各式各样的) differed; diversified; various
variety	n. Syn. diversity; assortment; selection	(变化,多样性,变种) diversity; quality or condition of being various or varied
various	a. Syn. diverse; assorted; different	(各种的) different; diverse; several; manifold; changeable; uncertain
varnish	n.	(涂上清漆,修饰) deceptively attractive external appearance; paint to coat a surface with a hard, glossy, transparent film
vary	v.	(改变,变化) change aspect of; alter in form, appearance, substance, position; make different by a partial change; modify
vast	a. Syn. large; broad; extensive	(巨大的,大量的,范围广的) large; broad; extensive; very great in size, number, amount, or quantity
vault	n.	(拱顶,地下室) arched brick or stone ceiling or roof; burial chamber usually underground
vegetable	n.	(蔬菜) any of numerous herbaceous plants to eat in meal
vehicle	n. Syn. automobile; instrument	(交通工具,车辆) automobile; means of conveying; medium
veil	n. Syn. cover; hide	(隐藏,遮蔽,面纱) a length of cloth worn by women over the head, shoulders, and often the face; cover; hide
vein	n.	(血管,静脉,木纹,矿脉,岩脉) blood vessel that carries blood
velocity	n. Syn. speed	(速度) rapidity or speed of motion; swiftness
vengeance	n. Syn. retribution; revenge	(报仇,报复) punishment inflicted in return for an injury or an offense; retribution
ventilate	v. Syn. freshen; aerate	(使通风) freshen; circulate through and freshen
ventilation	n.	(通风) act of supplying fresh air and getting rid of foul air
venture	v. Syn. adventure	(冒险(事业),投机活动) put at risk; adventure
verbal	a. Syn. oral	(口头的) expressed in spoken rather than written words; consisting of words alone without action
verge	n. Syn. border; edge	(边界) extreme edge or margin; border; enclosing boundary; space enclosed by such a boundary
verify	v. Syn. confirm; prove	(证明,证实) confirm; prove the truth of by presentation of evidence or testimony
versatile	a. Syn. flexible; pliable	(万能的,通用的,多面手的) having many talents; capable of working in many fields
verse	n. Syn. poetry	(诗,韵文) a piece of poetry
version	n. Syn. edition	(版本) written work in a new form; edition; interpretation of a particular viewpoint
vertical	a. Syn. upright; perpendicular	(垂直的,竖直的) upright in position or posture; oriented vertically
vessel	n. Syn. craft; ship	(船,液体容器) craft; ship; container for liquids
veteran	n.	(老兵,老手) someone who has given long service
veto	n. Syn. rejection; prohibition	(否决,否决权) rejection; vote that blocks a decision; deny; prohibit; command against
vex	v. Syn. annoy; distress	(激怒,惹恼) annoy; disturb, especially by minor irritations; be a mystery or bewildering to
via	ad.	(经由,途经,通过,凭藉) by the way of
vibrate	v.	(颤动,震动) shake, quiver; move or swing from side to side regularly
vibration	n. Syn. oscillation; shaking	(振动,颤动) act of vibrating; a shaky motion
vice	n. Syn. defect; fault; error	(不道德行为,缺德,代替) moral fault or failing; evil, degrading, or immoral practice or habit; physical defect or weakness
vicinity	n.	(附近,接近) state of being near in space or relationship; proximity
vicious	a. Syn. defective; imperfect	(有缺陷的,不完整的,危险的) by vice or defects; defective; imperfect; having the nature of vice; evil, immoral, or depraved
victorious	a. Syn. successful; triumphant	(获胜的,胜利的) successful; being the winner in a contest or struggle
victory	n.	(胜利,战胜) successful ending of struggle or contest; defeat of an enemy or opponent
vigor	n. Syn. strength; energy	(活力) active strength of body or mind; imaginative lively style, especially style of writing; exertion of force
vigorous	a. Syn. robust; strong; energetic	(健壮的,精力旺盛的,有力的) robust; strong; energetic, and active in mind or body
vine	n.	(葡萄藤,蔓) weak-stemmed plant that derives support from climbing
violate	v.	(违犯,违反,破坏,侵扰) treat in a violent manner; abuse; do violence to; disturb; interrupt
violence	n. Syn. force	(暴力,强暴) physical force exerted for the purpose of violating, damaging, or abusing
violent	a. Syn. turbulent	(暴力引起的,暴烈的) turbulent; intensely vivid or loud; by violence or bloodshed
violin	n.	(小提琴,小提琴手) small instrument with four strings, played with a bow; a fiddle
virtual	a.	(有效的,实质的,虚的) existing or resulting in essence or effect though not in actual fact; existing in mind, especially as a product of imagination
virtually	ad. Syn. almost completely; practically; essentially	(事实上,实质上) almost completely; practically; essentially
virtue	n. Syn. merit; goodness	(美德) goodness, moral excellence; good quality
virus	n.	(病毒) disease communicator; something that poisons one's soul or mind; program for unwanted actions in computer
viscous	a. Syn. sticky; gluey	(粘的) sticky; gluey; having high resistance to flow
visible	a.	(看得见的,可见的) being often in public eye; obvious to the eye
vision	n. Syn. sight	(视觉) ability to see; sight; vivid mental image
visual	a. Syn. visible; optical	(看到的,形象化的,视力的) seen or able to be seen by the eye; visible; optical
vital	a. Syn. critical; animated	(重要的,生命的,生机的) full of life; animated; necessary to continued existence; living or breathing
vivid	a. Syn. bright; lively	((光线,色彩)鲜艳的,强烈的) bright; lively; graphic; having striking color
vocation	n. Syn. career; profession	(才能,行业,职业) career; profession
vogue	n.	(时尚) popular fashion; current state or style of general acceptance and use
void	n. Syn. emptiness; space	(空白,空虚) emptiness; containing nothing; clear or empty a place
volcano	n.	(火山) fissure in the earth's crust through which molten lava and gases erupt
volley	n.	(（子弹、 石块等的）齐射,弹雨) flight of missiles; round of gunshots; tennis return made by hitting the ball before it bounces
voltage	n.	(电压) difference in electrical charge between two points
volume	n. Syn. capacity; bulk; amount	(体积,容积,量) capacity; amount of space occupied by an object
voluntary	a. Syn. willing; unforced	(自愿的,志愿的) done or undertaken of one's own free will; unforced
volunteer	n.	(自愿者) person who performs or offers to perform a service voluntarily
vote	n.	(投票) formal expression of preference for a candidate; number of cast in election; result of election or referendum
voter	n.	(投票者,选举人) a citizen who has a legal right to vote
voucher	n.	(代金券,优惠购物券,凭单,单据) a piece of substantiating evidence; proof; written authorization or certificate
vow	n. Syn. promise	(誓言,誓约,许愿,立誓出家修行,发誓,立誓,许愿) solemn promise made to God; promise of fidelity; pledge of love or affection
vowel	n.	(元音) speech sound made with the vocal tract open
voyage	n. Syn. journey; aviation	(旅行,航程) long journey to a foreign or distant place, especially by sea; aviation
vulgar	a.	(无教养的,平常的,粗俗的) common and coarse; relating to the common people with less cultivated or educated; lacking cultivation or refinement
vulnerable	a. Syn. defenseless; susceptible	(易受攻击的) susceptible to wounds; capable of being wounded or hurt
wade	v. Syn. paddle	(涉水,费力行走) paddle; walk through relatively shallow water
wag	v.	((狗尾巴等)摆动) move one way and the other with quick turns; shake to and fro; move in vibrating; cause to vibrate
wage	v.	(工资,进行,开展,发起) hazard on the event of a contest; stake; engage in, as a contest; adventure, or lay out, for hire or reward; hire; employ
wagon	n.	(四轮马车) any of various kinds of wheeled vehicles drawn by a horse or tractor
waist	n.	(腰,腰部) narrowing of the body between the ribs and hips
waive	v. Syn. yield; relinquish	(暂时放弃,屈从) give up temporarily; yield; give up voluntarily; defer
wake	n. Syn. track; course	(尾迹,痕迹) trail of ship or other object through water; path of something that has gone before
walnut	n.	(胡桃,核桃树) tree with 10 - 40 meters tall; hard, dark brown wood of any of these trees
wander	v.	(漫游,漫步,漂泊) move about without a definite destination or purpose; range about; stroll; go away; depart
ward	n.	(卫士,保护人,城区,(医院的)病区) guard; defender; protector; state under guard; division of a county; division of a hospital
wardrobe	n.	(衣橱,全部服装) tall cabinet, closet, or small room built to hold clothes
ware	n.	(制品,器具) articles of merchandise; style or class of manufactures; especially, in the plural, goods; commodities; merchandise
warehouse	n. Syn. depot; storehouse	(仓库,货栈) depot; storehouse for goods and merchandise
warfare	n.	(战争,斗争状态) military service; military life; contest carried on by enemies
warrant	n. Syn. guarantee	(保证书,质保书,证书) guarantee; assurance by seller; authorization or certification
warrior	n. Syn. fighter; combatant	(战士,勇士) fighter; combatant; one who is engaged in or experienced in battle
waterproof	a. Syn. tight	(防水的) tight; unaffected by water; made of or covered with material that doesn't allow water in
waver	v.	(摇摆,犹豫) play or move to and fro; move one way and the other; swing; be unsettled in opinion
wax	v. Syn. increase; grow	(增长) increase gradually in size, number, strength, or intensity; show a progressively larger illuminated area
weapon	n. Syn. arms	(武器) arms
weary	a. Syn. tired; exhausted; fatigued	(疲倦的,厌倦的) tired; exhausted; physically or mentally fatigued
weather	v.	(侵蚀,风化) endure the effects of weather or other forces; come through safely; survive
weave	n. Syn. swing	(编织,编织样式) pattern or structure by weaving ; knit; interlace
weaver	n.	(织布者,织工) craftsman who weaves cloth
web	n.	(蜘蛛网,网状物,织物,蹼) textile fabric; complex, interconnected structure or arrangement; the World Wide Web; radio or television network
wedding	n.	(婚礼) marriage ceremony; act of marrying; anniversary of a marriage
wedge	n.	(楔形物,楔子) a piece of metal, or other hard material, thick at one end, and tapering to a thin edge at the other, used in splitting wood, rocks
weed	n.	(杂草) undesirable or troublesome plant, especially growing where it is not wanted as in a garden.
weld	v.	(焊接) unite closely or intimately; join together by heating
welfare	n. Syn. benefit	(福利) benefit; something that aids health or happiness
whereas	ad.	(但是,相反,鉴于,因) while on the contrary; while at the same time
whereby	ad.	(藉此,凭这个,由此) by which; by what; how
whilst	ad.	(当时,有时,时时) while; at the same time
whip	v.	(覆盖,清除) overlay with other cords going round and round it; take or move by a sudden motion; clean completely
whirl	n.	(使飞快地旋转,眩晕,乱七八糟) act of rotating or revolving rapidly; state of confusion; tumult
whisper	n.	(耳语,低声说话) speaking in a quiet voice; soft speech produced without full voice; secretly expressed belief, rumor, or hint
whistle	v.	(哨子,汽笛,口哨,哨声) make a kind of musical sound by lips; emit a similar sound from mouth as birds
wholesale	a.	(批发的) selling or related to selling goods in large quantities; large-scale; on a large scale without careful discrimination
wholesaler	n.	(批发商) someone who buys large quantities of goods and resells to merchants
wholesome	a. Syn. healthful; beneficial	(有益健康的) conducive to sound health or well-being; beneficial
wicked	a. Syn. sinful; immoral; profligate	(非常坏的,险恶的,绝妙的) evil in principle or practice; contrary to moral or divine law; addicted to vice or sin
widespread	a.	(流传甚广的,分布广的) spread or scattered over a considerable extent; occurring or accepted widely
width	n.	(宽度,一幅(布)) measurement of the extent of something from side to side
wield	v. Syn. rule; manage; handle	(支配,掌握) handle with skill; exercise effectively; have power over; rule or manage
wilderness	n.	(荒野,荒凉的地方) a tract of land or region, uncultivated and uninhabited by human beings, whether a forest or a wide, barren plain; wild or desert
willow	n.	(柳树) trees having usually narrow leaves
winding	a.	(蜿蜒的,迂回的) twisting or turning; spiral
wisdom	n. Syn. discretion; sagacity	(智慧,才智) quality of being wise; knowledge ; results of wise judgments
wit	n. Syn. intellect; cleverness	(智力,才智) intellect; mental ability; natural ability to perceive and understand
withdraw	v. Syn. retreat; depart	(撤退) remove from; pull back; break from gathering; retreat; depart
withdrawal	n. Syn. secession	(收回,撤退,退回) secession; retreat or retirement
wither	v. Syn. shrivel; decay	(凋谢,枯萎) shrivel; decay; lose freshness, vigor, or vitality; loss of moisture
withhold	v. Syn. keep; restrain	(拒给,保留) refuse to give; refrain from giving, granting, or permitting; deduct from employee's salary
withstand	v. Syn. oppose	(抵抗,经受住) stand up against; successfully resist; oppose with force or resolution
witness	n. Syn. observe; watch	(目击,作证) someone who sees an event and reports what happened; observe; watch
woe	n. Syn. affliction; regret	(悲哀的) deep, inconsolable grief; affliction; suffering; deep distress or misery, as from grief
woods	n. Syn. forest; woodland	(森林) small forest; woodland; dense collection of trees covering a relatively small area
wool	n.	(羊毛) dense, soft, often curly hair forming the coat of sheep and certain other mammals
wording	n.	(措辞,用语) act or style of expressing in words; expression, or power of expression
worldwide	a.	(全世界的) global; universal; throughout the world
worst	v. Syn. defeat	(击败,胜过) be better than; defeat; gain the advantage over
worthwhile	a.	(值得做的) sufficiently valuable; important to be worth one's time, effort, or interest
wrap	v. Syn. enclose	(裹,包,捆) enclose; arrange or fold as a cover or protection
wrath	n. Syn. anger; fury	(恼火,愤怒) forceful, often vindictive anger; fury; just punishment of an offense or crime
wreck	n. Syn. destruction; ruins	(失事,失事的残骸) destruction; destroy; smash or break forcefully
wrench	v. Syn. pull; strain; twist; jerk	(扭曲,曲解,折磨,拉) twist or turn suddenly and forcibly; move, extract, or force free by pulling violently
wrestle	v.	(摔跤,角力) contend by grappling with, and striving to trip or throw down an opponent; struggle or strive earnestly
wretched	a.	(不幸的,潦倒的(人),质量差的,令人不满意的) very miserable; sunk in, or accompanied by deep affliction or distress; calamitous; woeful; worthless
wring	v. Syn. twist; squeeze	(绞,拧,扭) twist; squeeze; compress, especially so as to extract liquid
wrinkle	n. Syn. furrow; crease	(小困难,皱纹,褶皱) a minor difficulty; a slight depression in the smoothness of a surface
wrist	n.	(手腕,腕关节) joint between the hand and the forearm
yacht	n.	(帆船,游艇) light ship used for private pleasure trips
yard	n.	(码,长棍,长条) rod; stick; branch; long piece of timber; measure of length, equaling three feet
yawn	n.	(呵欠) open the mouth wide with a deep inhalation, usually involuntarily from drowsiness, fatigue, or boredom
yearn	v.	(盼望,渴望) pain; grieve; vex; be pained or distressed; feel deep pity, sympathy, or tenderness
yeast	n.	(酵母,兴奋) foam, or troth, or the sediment, of beer or other in fermentation
yield	v. Syn. surrender; concede	(屈服,放弃) give in; surrender; give forth a natural product; be productive
yoke	v. Syn. join; bind	(结合,连接) join together, unite; harness a draft animal to; join securely; force into heavy labor
yolk	n.	(蛋黄) nutritive material; greasy substance found in unprocessed sheep's wool; yellow part of an egg
zeal	n. Syn. fever; ardor	(热心,热诚) intense interest; eagerness to accomplish some object
zealous	a. Syn. enthusiastic; fervent	(热心的,狂热的) enthusiastic; filled with or motivated by zeal
zone	n. Syn. region; district	(区域,地带) region; portion of the surface of a sphere;
zoology	n.	(动物学,动物(总称)) part of biology which relates to the animal kingdom
cab	n. Syn. taxi; taxicab	(出租马车,汽车) taxi; one-horse vehicle for public hire
cabin	n. Syn. cottage	(小屋(通常为木制的),船舱) small room on a ship or boat where people sleep
cabinet	n.	(橱柜,政府内阁) group of persons appointed by a head of state or a prime minister; hut; cottage; small house; small room; closet
cable	n.	(缆索,钢丝绳,电缆) very strong thick rope made of twisted steel or metal wire
cafe	n.	(咖啡馆,小餐馆) coffee house; restaurant where coffee and liquors are served
cafeteria	n.	(自助餐馆) restaurant where you serve yourself and pay a cashier
calculate	v. Syn. compute; determine; estimate	(计算,估计) compute; determine; estimate
calculation	n.	(计算,考虑) planning something carefully and intentionally
calendar	n.	(历法,日历,月历,一览表,记录表) orderly arrangement as years, months, weeks, and days; a table showing months, weeks, and days
calm	a. Syn. placid; quiet; tranquil	((天气,海洋等)静的,平静的) freedom from motion, agitation, or disturbance; tranquility; stillness; quiet; serenity
calorie	n.	(卡路里(热量单位)) unit of heat; unit of heat equal to the amount of heat required to raise the temperature of 1 kilogram of water by 1 degree
campaign	n. Syn. drive; battle	((政治或商业性)活动,竞选活动) battle ;a series of actions advancing a principle or tending toward a particular end
campus	n.	(校园) field where the buildings of a university are situated
canal	n. Syn. tube	(运河,沟渠,(人体内的)管道) artificial channel filled with water; tube or duct
canary	n.	(金丝雀,女歌星) pale yellowish color; wine made in the Canary Islands; canary bird; quick and lively dance
cancel	v. Syn. revoke	(取消) revoke; call off; omit or delete
cancellation	n.	(取消) act of cancelling; calling off some arrangement
candid	a. Syn. straightforward; frank	(率直的,坦白的) straightforward; frank; free from prejudice; impartial
candidate	n.	(候选人) person who is considered for something; person who seeks or is nominated for an office, prize, or honor
cane	n. Syn. stick	(茎,笞杖,棍,棒) any plant with long, hard, elastic stems; walking stick
cannon	n.	(加农炮,大炮) great gun; firearm for discharging heavy shot with great force; loop at the top of a bell by which it is hung
canon	n.	(经典,真作) law or rule; decision, regulation, code, or constitution made by authority; books of the Bible officially accepted; a group of literary works
canteen	n.	(小卖部,临时流动餐馆,军用炊具,水壶) vessel used by soldiers for carrying water, liquor, or other drink; snack bar or small cafeteria, as on a military installation
canvas	n.	(帆布,画布) heavy closely woven fabric; background against which events unfold, as in a historical narrative
canvass	v.	(调查,投票) determine votes; examine carefully or discuss thoroughly; scrutinize
capability	n. Syn. capacity; skill	(能力,性能,容量) quality of being capable; capacity; skill
capable	a. Syn. competent	(有能力的) having the ability required for a specific task
capacity	n. Syn. volume; ability; capability	(容量,生产量,能力) mental or physical ability; ability to accommodate
cape	n.	(披风,斗篷,岬,海角) piece or point of land, extending beyond the adjacent coast into the sea or a lake; sleeveless outer garment
capital	n.	(首都,首府,省会,资本,资金,大写字母) wealth in form of money or property; assets available for use; city that is the official seat of government
caption	n. Syn. title	(标题) title; chapter heading; text under illustration
captive	n.	(俘虏,被俘虏人,被拘禁的人) prisoner taken by force; one kept in power of another; one charmed or subdued by beauty, excellence, or affection
capture	n.	(捕获,俘获,赢得,缴获品) act of seizing by force, or getting possession of by superior power; thing taken by force, surprise, or stratagem
card	n.	(卡片,明信片,纸牌) flat, rectangular piece of stiff paper, cardboard, or plastic; business card; credit card
cardinal	a. Syn. chief	(主要的) chief; serving as an essential component
career	n. Syn. vocation; occupation	(生涯,职业) profession or occupation; individual’s work and life roles over their lifespan
careful	a. Syn. deliberate; cautious	(小心的,仔细地) full of care; anxious; solicitous; taking care; giving good heed; watchful; cautious
careless	a. Syn. negligent; heedless	(粗心的,疏忽的) negligent; taking insufficient care
cargo	n. Syn. shipload; freight	((车,船,飞机等运输的)货物) freight carried by a ship, an aircraft, or another vehicle
carol	n.	(赞美诗,颂歌) round dance; a song of joy; song of praise or joy, especially for Christmas
carpenter	n.	(木匠,木工) skilled worker who makes, finishes, and repairs wooden objects and structures
carrier	n. Syn. messenger	(运送人,运载工具,航空母舰,货架) one that carries or conveys; messenger
carrot	n.	(胡萝卜) root of cultivated varieties of the plant, usually spindle-shaped, and of a reddish yellow color
carry	v.	(运送,搬运) convey or transport in any manner from one place to another; hold or support while moving; bear
cart	n.	(二轮运货马(或牛)车,手推车) common name for various kinds of vehicles; two-wheeled vehicle; light business wagon
carton	n.	(纸板箱,纸板盒) pasteboard for paper boxes; pasteboard box
cartoon	n.	(讽刺画,漫画,卡通电影,动画电影) design or study drawn of full size to serve as a model for transferring or copying; drawing depicting a humorous situation
carve	v. Syn. cut; sculpt	(切开,雕刻) cut; sculpt
carving	n.	(雕刻品,雕花) cutting away parts to create a desired shape
cash	n.	(现金,零钱,钱,兑现,付款) money paid at the time of purchase; money in the form of bills or coins; currency
cashier	n.	(出纳员) one who has charge of money; cash keeper
cassette	n.	(盒式磁带) container that holds a magnetic tape used for recording or playing sound or video
cast	v.	(分派角色,随机选择) assign the roles of; choose at random
casual	a. Syn. informal; purposeless; unplanned	(非正式的,随便的,漫不经心的) informal; purposeless; occurring by chance
casualty	n.	(严重的事故,伤亡) serious or fatal accident; someone injured or killed in an accident
catalyst	n. Syn. enzyme; stimulus	(催化剂) agent which brings about chemical change while it remains unaffected and unchanged
catastrophe	n. Syn. calamity; disaster	(灾难) calamity; disaster; state of extreme ruin and misfortune
catch	v.	(偶然遇到,遭遇) capture or seize, especially after a chase; take by or as if by trapping; reach just in time
category	n. Syn. group	(种类,类目,范畴) group; class; collection of things sharing a common attribute
cater	v.	supply what is needed or desired; provide food professionally for special occasion
cathedral	n. Syn. church; temple	(总教堂,大教堂) church; temple
catholic	a. Syn. universal	(一般的,普遍的,天主教的) broadly sympathetic; universal; related to Roman Catholic Church
cause	n.	(导致,引起) something produces a result; basis for an action or response; a reason
caution	n. Syn. care	(小心,谨慎) care; being attentive to possible danger
cautious	a. Syn. conservative; careful	(小心的,谨慎的) conservative; careful
cavalry	n.	(骑兵部队) part of military force which serves on horseback
cavern	n. Syn. cave	(大山洞,大洞穴) cave; large underground chamber, as in a cave
cavity	n. Syn. hole; cavern	(洞,腔,蛀洞) hole; cavern; hollow area within the body
cease	v. Syn. stop; terminate	(停止,终止) stop; terminate; put an end to; discontinue
celebrate	v. Syn. praise	(庆祝,祝贺,表扬,赞美) praise; assign great social importance to
cell	n.	(细胞,单人牢房,电池) any small compartment
cellar	n.	(地下室,酒窖) room or rooms under a building, and usually below the surface of the ground
cement	n.	(水泥,胶泥,结合剂) any substances used for making bodies adhere to each other; bond of union; concrete pavement
cemetery	n. Syn. graveyard	(坟墓,公墓) place or ground set apart for the burial of the dead; graveyard
censor	n.	(审查) overseer of morals; official responsible for removal of objectionable or sensitive content
centigrade	a.	(华氏) measure of temperature, used widely in Europe
cereal	n.	(谷类,谷类食品) grass such as wheat, oats, or corn, the starchy grains of which are used as food.
ceremonial	n. Syn. ritual; ceremony	(仪式) ritual; ceremony or rite
ceremony	n. Syn. ritual; rite	(典礼,仪式,礼节) formal act or set of acts performed as prescribed by ritual or custom
