farewell	n.	(再见,一路平安) acknowledgment at parting; goodbye; act of departing or taking leave
fascinate	v. Syn. intrigue; enthrall; captivate	(使着迷,使神魂颠倒) cause to be interested or curious; captivate
fascination	n.	(入迷,迷恋,魅力) capacity to attract intense interest
fashion	n. Syn. vogue; style	(流行,风尚,流行式样) style, shape, appearance, or mode of structure; pattern, model
fashionable	a. Syn. stylish	(流行的,时髦的,上流社会的) conforming to the current style; being or in accordance with current fashion
fasten	v. Syn. attach; affix	(使固定) attach; affix
fatal	a.	(致命的) causing death
fathom	v.	(领会,调查,测量) measure the depth; come to understand
fatigue	n. Syn. weariness; exhaustion	(疲乏,劳累) physical or mental weariness; exhaustion
fault	n. Syn. crack	((地质学)断层) crack; a crack in the earth; defect; flaw; a wrong action
favorable	a. Syn. propitious; beneficial; approving	(有利的,有助的,赢得赞扬的 I hope you will give favorable consideration to my suggestion.我希望你对我的建议作出肯定的表示。) approving or pleasing; granting what has been desired or requested
feasible	a. Syn. practical; possible; suitable	(可行的) capable of being accomplished or brought about
feast	n.	(宴会,筵席,宗教节日) festival or holiday; festive or joyous meal; something highly agreeable; entertainment
feat	n. Syn. achievement; accomplishment	(功绩,特指勇敢的行为,壮举) achievement; accomplishment
feature	n.	(特征,特色,容貌,相貌) prominent aspect of something
federal	a.	(联邦的,联邦制的,联邦政府的) of or relating to central government; national
federation	n.	(联盟,同盟,联邦政府) uniting in a league; confederation; league
fee	v.	(报酬,薪水,费用) give a tip beyond the agreed-on compensation
feeble	a. Syn. weak; frail	(微弱的,衰弱的) lacking vigor, force, or effectiveness; faint; frail
feed	v. Syn. nourish; graze	(喂养,饲养,吃草,靠…为生) give food to; supply with nourishment
feedback	v.	((信息的)反馈) response to an inquiry or experiment
fell	a. Syn. cruel; deadly	(凶猛的,致命的) capable of destroying; lethal
fellowship	n.	(团体,协会) state or relation of being or associate; companionship of persons on equal and friendly terms; state of being together
female	n.	(女性的,雌性的) for or composed of women or girls
ferocious	a.	(凶猛的,残暴的) fierce; savage; wild; indicating cruelty
ferry	n. Syn. shuttle; barge	(渡口,渡船) shuttle; transport by boat or aircraft
fertile	a. Syn. rich; fruitful	(肥沃的,富饶的,能繁殖的) rich; fruitful; inventive; creative; intellectually productive
fertilizer	n.	(肥料) any substance used to make soil more fertile
fervent	a.	(炙热的,诚挚的) extremely hot; sincerely or intensely felt
festival	n. Syn. holiday	(节日) a day or period of time for feasting and celebration
fetch	v.	(取来,拿来) take away or remove; reduce; go or come after and bring or take back
feud	n. Syn. enmity; vendetta	(世仇,部落或家族间的怨恨) bitter quarrel between two parties
fiber	n.	(纤维,光纤) slender, elongated, threadlike object or structure; material to make paper or cloth
fiction	n. Syn. story; legend	(小说,(虚构)故事) story; imaginative creation; literary work whose content is produced by imagination
fictional	a. Syn. imaginary	(虚构的) imaginary; invented, as opposed to real
fierce	a. Syn. ferocious; savage	(凶猛的) ferocious; savage; extremely severe or violent; terrible
fig	n.	(无花果,一点儿) small fruit tree with large leaves, known from the remotest antiquity
figurative	a.	(比喻) not literal, but metaphorical; using figure of speech
figure	n.	(人像,画像,外形,轮廓) model of a bodily form; impression produced by a person; written or printed symbol representing a number
file	v.	(档案) line; proceed in line
filter	n. Syn. strain; purify	(过滤) strain; pass liquid or gas through device that blocks some matter by particular criterion
filth	n.	(肮脏,粗语) foul matter; anything that soils or defiles; dirt; corruption; pollution
filthy	a.	(龌龊的,污秽的) nasty; dirty; polluted; foul; impure
final	a. Syn. last	(最后的,最终的) forming or occurring at the end; terminating; ultimate; conclusive
finance	n. Syn. fund	(财政,拨款) management of money and credit and banking and investments; subsidizing; fund
financial	a. Syn. monetary	(财政的) monetary; pertaining or relating to money matters
financing	n. Syn. subsidy; funding	(筹集资金,融资) subsidy; transaction that provides funds for a business
finite	a.	(有限的,限定的) having a limit; limited in quantity, degree, or capacity; bounded
fir	n.	(杉木) any of various evergreen trees of the genus Abies
firm	a. Syn. hard; solid; determined	(结实的,坚定的) hard; solid; resolute; determined
fishery	n.	(渔场,渔业) business or practice of catching fish; fishing; a place for catching fish; the right to take fish at a certain place
fist	n.	(拳头) hand with the fingers doubled into the palm; closed hand
fit	v.	(合适的,适宜的,健康的,结实的) be the right size or shape; conform to some shape or size
fitness	n. Syn. health; vigor	(健康) health; vigor; state or condition of being fit; suitability or appropriateness
fitting	n.	(试穿,试样,设备,装备) small accessory to a larger system; small detachable part for a machine or apparatus; act of trying on clothes
fixed	a. Syn. stationary; settled; established	(固定的,不变的) firmly in position; stationary
fixture	n. Syn. commonplace object	(固定设备) commonplace object; object firmly fixed in place
flag	v. Syn. decline; weaken; fade	(萎缩,衰退) become less intense; sink, or settle from pressure
flake	n. Syn. peel; chip	(使成薄片,雪片) flat thin piece or layer; chip; small piece; small crystalline bit of snow
flame	n. Syn. blaze; fire	(火焰,燃烧着,以前的情人,烧得通红) stream of burning vapor or gas, emitting light and heat; passion of love
flap	n.	(拍动,拍击声,拍打) flat, usually thin piece attached at only one side; act of waving or fluttering; blow given with something flat; slap
flare	v.	(闪光,闪耀) sudden outburst of emotion; glare; shine; shine with sudden light
flash	n. Syn. flare; spark	(闪光,闪现) emit a brief burst of light; appear briefly; sudden intense burst of radiant energy
flask	n.	(烧瓶,细颈瓶) a small bottle-shaped vessel for holding fluids; narrow-necked vessel of metal or glass
flatter	v.	(奉承,谄媚) compliment someone, often insincerely and sometimes to win favor; enhance someone's vanity by praising them
flavor	n. Syn. taste; savor	(味,风味) distinctive taste; quality produced by the sensation of taste
flaw	n.	(瑕疵,缺陷,裂痕) crack or breach; gap or fissure; defect; fault; sudden burst of noise and disorder
flee	v.	(逃走,出国避难) run away, as from danger or evil; avoid in alarmed or cowardly manner
fleece	v. Syn. rob; plunder	(抢劫,骗取钱财) rob; strip of money or other property unjustly, especially by trickery or fraud; ask unreasonable price
fleet	n.	(舰队,车队) a group of steamships under the same ownership; a group of vessels or vehicles
flesh	n.	(肉,肌肉,食用肉,果肉) soft tissue of body, mainly muscle and fat; substance; reality; surface or skin of human body; meat of animals
flexibility	n.	(灵活性) quality of being adaptable or variable
flexible	a. Syn. pliant; elastic; docile	(易弯曲的,柔软的,变通的) pliant; elastic; capable of being bent or flexed; pliable
flicker	v.	(闪烁,摇曳) flutter; flap the wings without flying; waver unsteadily, like a flame in a current of air
fling	v. Syn. discard	(扔,投,抛,摆动) throw with force or recklessness; throw or cast away; move in an abrupt
float	v.	(漂浮,使漂浮) drift along; make the surface of level or smooth; move lightly
flock	n. Syn. group; herd; crowd	(一群同类的牲畜) group; herd; crowd; gather; crowd; throng
flour	n.	(面粉,制成粉) fine powdery foodstuff; soft, fine powder
flourish	v. Syn. prosper	(生长,繁荣,装饰) grow well; decorate with ornaments; be in a period of productivity
fluctuate	v. Syn. waver; shift	(波动的,起伏的,摇摆不定的) rise and fall in or as if in waves; shift; vary irregularly
fluctuation	n.	(波动,起伏) a wave motion
fluency	n.	(（语言）流利) quality of smoothness of flow; quality of being fluent in language
fluent	a. Syn. articulate; eloquent; graceful	(流利的,流畅的) easy and graceful in shape; graceful; smooth and unconstrained in movement
flush	v.	(脸红) turn red, as from fever, embarrassment, or strong emotion; glow, especially with a reddish color; flow suddenly
flutter	v.	(拍翅振翼,振翼而飞,不安,焦急) vibrate or move quickly; drive in disorder; throw into confusion; wave or flap rapidly in an irregular manner
flux	n. Syn. flowing; fusion	(变迁,流动) flowing; series of changes; state of being liquid through heat
foam	n.	(泡沫) white substance, consisting of an aggregation of bubbles, which is formed on the surface of liquids
focus	n.	(中心点,焦点,中心) most important thing; a fixed reference point; center of interest or activity
fodder	n.	(粗饲料,饲养) coarse food for cattle or horses
foe	n. Syn. enemy; adversary	(敌人,敌军) enemy; one who entertains hatred, grudge; adversary
fog	n. Syn. haze	(雾) droplets of water vapor suspended in air near ground ; haze
foggy	a.	(雾深的,模糊的) obscured by fog; indistinct or hazy in outline
fold	v.	(折叠) make something double; bend or lay so that one part covers the other
foliage	n. Syn. leaves; leafage	(树叶) masses of leaves; a cluster of leaves, flowers, and branches
foolish	a. Syn. silly; ridiculous; stupid; silly; unwise	(愚蠢的) marked with, or exhibiting, folly; void of understanding; weak in intellect; without judgment
forbid	v.	(禁止) not allow; prohibit; prevent
forecast	n. Syn. prediction; outlook	(预测,预报) prediction about how something will develop, as for weather
forefather	n. Syn. ancestor	(祖先,祖宗) ancestor; forebear
foremost	a. Syn. leading; main; primary	(最先的,最重要的,第一流的) leading; main; primary; first in time or place
foresee	v. Syn. anticipate; predict	(预见,预知) anticipate; predict
foretell	v. Syn. predict; forecast	(预示,预测) tell of or indicate beforehand; predict
forge	n.	(铸造,伪造) workplace where metal is worked by heating and hammering
forgery	n.	(伪造(物)) act of forging, especially the illegal production of something counterfeit
forgive	v. Syn. pardon	(原谅,宽恕) give wholly; cease to feel resentment against; excuse for a fault or an offense; give up; resign
formal	a. Syn. official; ceremonious	(正式的,形式的,合乎礼仪的) official; executed, carried out, or done in proper or regular form
formality	n.	(仪式,礼节) quality or condition of being formal; something done just for form's sake
format	v. Syn. pattern; design	(模式,格式) pattern; design; set into a specific pattern
formation	n. Syn. synthesis; configuration; pattern	(形成,结构) configuration; pattern
former	a. Syn. previous; earlier	(从前的,以前的) preceding in order of time; antecedent; previous; prior; earlier
formerly	ad. Syn. previously; once	(从前,以前) previously;at an earlier time; once
formidable	a. Syn. menacing; threatening	(威胁的,险恶的) arousing fear; threatening; difficult to undertake or defeat
formula	n.	(公式,规则) plan; directions for making something; a group of symbols that make a mathematical statement
formulate	v. Syn. policy; theory	(系统地阐述,创立理论) decide upon and express in words
forsake	v. Syn. forgo	(放弃) leave someone who needs or counts on you
fort	n. Syn. fortress; stronghold	(要塞,堡垒) a fortified defensive structure; permanent army post
forthcoming	a.	(即将到来的,准备好的,现成的) ready or about to appear; making appearance
fortitude	n. Syn. bravery; courage	(勇敢的) bravery; force; power to attack or to resist attack
fortnight	n.	(两星期) a period of fourteen consecutive days
fortress	n. Syn. fort; castle	(要塞,城堡) fort; castle; fortified place, especially a large military stronghold, often includes a town
fortunate	a. Syn. lucky	(幸运的) lucky; bringing something good and unforeseen
fortune	n. Syn. treasure; luck	(财富,运气) arrival of something in a sudden or unexpected manner; chance; accident; luck
forum	n.	(论坛) place to discuss public concerns; meeting or medium for open discussion
forward	ad.	(向前的,靠近前面的) at or to or toward the front; toward the future
fossil	n. Syn. remnant	(化石,僵化的事物) remnant; remains of a plant or animal that existed in a past geological age
foster	v. Syn. rear	(养育,培养,鼓励) rear; promote the growth of; help develop
foul	n. Syn. disgusting; filthy	(犯规) act that violates of the rules of a sport
found	v.	(建立,创建,出资开办) establish or set up, especially with provision for continuing existence; melt metal and pour into a mold
foundation	n.	(建立,创办,建筑物,基金会,基金) basis on which something is grounded
founder	n.	(创办人) person who establishes an organization, business
fountain	n.	(喷泉,喷水池,喷水) spring of water issuing from the earth; artificially produced jet or stream of water
fraction	n. Syn. segment; fragment	(小部分,少量) segment; fragment; a small proportion of
fracture	v. Syn. break; crack	(骨折,破裂) break into pieces; crack; destroy; violate or abuse
fragile	a. Syn. delicate; brittle; weak	(易碎的,脆的) easy to destroy, delicate, not strong
fragment	n. Syn. piece; fraction	(碎片) small part broken off or detached; fraction
fragrance	n.	(香味,芳香) scent; aroma; distinctive odor that is pleasant
fragrant	a. Syn. aromatic; odorous	(香的,芬芳的) pleasant-smelling; odorous
frail	a. Syn. weak	(弱的) physically weak; easily broken
frame	n. Syn. construct	((木材,金属等做的)框架) structure that gives shape or support; closed, often rectangular border of drawn or printed lines
framework	n. Syn. structure; skeleton	(构架,骨架) fundamental structure, as for a written work; skeleton
franchise	n.	(公民权,营业执照) right granted by authority; right to vote; business licensed to sell a product in particular area
frank	a. Syn. honest; sincere; straightforward	(坦白的,直率的) honest; sincere; open and sincere in expression; straightforward
freight	n.	(货物,货运) transport commercially as cargo; load with goods; goods carried by a large vehicle
fret	v. Syn. vex	(被激怒) cause to be uneasy; wear away
friction	n. Syn. abrasion; scraping	(摩擦) clash in opinion; rubbing against; conflict
frightening	a.	(令人恐惧的,引起突然惊恐的) inspiring with fear; causing fear; of capable of causing fear; scary
fringe	n. Syn. margin; periphery	(边缘,边界) margin; periphery; decorative border of hanging threads, cords, or strips, often attached to a separate band
frontier	n.	(边界,边疆,未开拓领域) part of a country which fronts or faces another country or an unsettled region; border, confine, or extreme part of a country
frost	n.	(霜,霜冻) ice crystal; weather cold enough to cause freezing; provide with a rough surface or appearance
frown	v.	(皱眉) look angry; wrinkle one's forehead; regard something with disapproval or distaste
frugal	a. Syn. sparing; economical; thrifty	(节约的,精打细算) sparing; economical; costing little; inexpensive
fruitful	a. Syn. productive; fertile	(硕果累累的,成功的) productive; fertile; producing results; profitable
frustrate	v. Syn. thwart; defeat	(阻碍,挫败) make null; bring to nothing; prevent from taking effect or attaining fulfillment
frustration	n. Syn. disappointment; failure	(挫败,挫折) disappointment; failure; act of frustrating
fuel	n.	(燃料,刺激物,加燃料) substance that can be consumed to produce energy
fulfil	v. Syn. fulfill	(实现,满足,完成) fill full; fill to the utmost capacity, as a vessel, a room; make full or complete
full	a.	(满的,吃饱的,过饱的,完全的) filled to satisfaction with food or drink; containing as much or as many as is possible or normal
fumble	v.	((笨拙地)摸索,搜寻) feel or grope about; make awkward attempts to do or find something; play childishly
function	n.	(功能) act of executing or performing any duty; assigned duty or activity
functional	a. Syn. useful	(功能的,有用的) useful; in good working order
fund	n. Syn. money; capital	(资金,基金) money; capital; a reserve of money set aside for some purpose; finance; subsidize
fundamental	a. Syn. primary; essential	(基本的,基础的) relating to foundation or base; elementary; primary; essential
funeral	n.	(葬礼,丧礼) ceremony held in connection with burial; burial procession accompanying body to grave; end of existence
furious	a.	(狂怒的,狂暴的) extreme anger; raging; full of activity; energetic or rapid
furnace	n.	(熔炉,高炉,火炉) enclosed place in which heat is produced; place or time of punishment or great trial; intensely hot place
furnish	v. Syn. provide; supply	(为某物提供家具,用家具布置) provide; supply; equip with what is needed, especially to provide furniture for
furniture	n.	(家具) movable articles in a room or an establishment that make it fit for living or working
furrow	n.	(犁沟,皱纹) trench in the earth made by a plow; any trench, channel, or groove, as in wood or metal; wrinkle on the face
further	v. Syn. advance	(促进,增进) get greater distance; make more in advance
furthermore	ad.	(而且,此外) in addition; moreover; still further
fury	n. Syn. anger	(愤怒,狂怒) violent anger; rage; uncontrolled action; turbulence
fuse	v. Syn. combine; blend	(熔合,熔化) combine; blend; become plastic or fluid or liquefied from heat
fuss	n. Syn. protest	(大惊小怪,过份照顾) angry disturbance; excited state of agitation; needlessly nervous or useless activity; protest; quarrel
fussy	a.	(爱挑剔的) easily upset; given to bouts of ill temper; full of superfluous details
gale	n. Syn. windstorm	(大风,一阵感情的爆发) very strong wind; gust of wind; emotional outburst as laughter or tears
gallery	n.	(画廊,美术馆) long usually narrow room ; covered corridor
gallop	v.	((马)飞奔,疾驰) move or run rapidly or carelessly, as by a quadruped, particularly by a horse lifting alternately the fore feet and the hind feet, in successive leaps or bounds
gamble	v.	(赌纸牌,赌博,投机) play or game for money or other stake; lose or squander by gaming
gang	n.	(一队(工人),一群(囚犯),一帮(歹徒),一伙) group of criminals who band together for mutual protection and profit; herd of buffalo or elk
gaol	n. Syn. jail	(监狱,监牢) place of confinement, especially for minor offenses or provisional imprisonment
gap	n. Syn. opening; crevice	(裂口,缺口) opening through mountains; pass; conspicuous difference or imbalance
garbage	n. Syn. trash; rubbish; waste	(垃圾,废物) trash; worthless or nonsensical matter; food wastes
garment	n.	(衣服) any article of clothing, as coat or gown
gasoline	n. Syn. petrol	(汽油) petrol; flammable liquid consisting of a mixture of refined petroleum hydrocarbons
gauge	n. Syn. measure; judge	(标准量度,计量器) measuring instrument; measure; judge
gaze	v.	(凝视,注视) fix the eyes in a steady and earnest look; look with eagerness or curiosity, as in admiration, astonishment
gear	n.	(齿轮,传动装置,排挡) toothed machine part, such as a wheel or cylinder, to transmit motion or to change speed or direction
gem	n. Syn. jewel	(宝石,珠宝) precious stone; jewel; pearl or mineral that has been cut and polished for use as an ornament
generalization	n.	(概括) an idea having general application; reasoning from detailed facts to general principles
generalize	v. Syn. infer; deduce	(归纳,概括) reach conclusion; become systemic and spread throughout the body
generate	v. Syn. cause; produce; create	(产生,创造) bring into being; give rise to; produce
generation	n.	(世代,一代人) all offspring at same stage from common ancestor; interval of time between the birth of parents and their offspring
generator	n.	(发电机) one that generates, especially converts mechanical energy into electrical energy; apparatus that generates vapor
generosity	n.	(慷慨,大方) noble birth; quality of being noble; noble-mindedness; liberality in giving
generous	a. Syn. magnanimous	(慷慨的) more than adequate; willing to give and share unstintingly
genius	n.	(天才,天赋,才华) exceptional creative ability; unusual mental ability; someone who is dazzlingly skilled in any field
gentle	a.	(和善的,温和的,柔和的) well-born; of a good family or respectable birth; mild; meek; bland; amiable; tender
genuine	a. Syn. authentic; real; true	(真正的,真实的) authentic; real; true
geology	n.	(地质学) science which treats the structure and mineral constitution of the globe
geometry	n.	(几何学) mathematics of the properties, measurement, and relationships of points, lines, angles, surfaces, and solids
germ	n.	(病菌,细菌,根源) bacteria; earliest form of an organism; seed
gesture	n.	(手势,示意动作) motion of hands or body to emphasize or help to express a thought or feeling
giant	n.	(巨人,巨大的怪物) person of extraordinary strength or powers, bodily or intellectual
gigantic	a. Syn. mammoth; huge; enormous	(巨大的) exceedingly large; huge; very large or extensive
giggle	v.	(格格地笑,傻笑,格格笑,傻笑) laugh with short catches of the breath or voice; laugh in light, affected, or silly manner
ginger	n.	(姜,活力) plant of the genus Zingiber, of the East and West Indies
glare	n. Syn. light; brightness	(眩目的光) light; brightness; fierce or angry stare
glassware	n.	(玻璃制品) an article of tableware made of glass
gleam	v.	(亮光,闪光,发闪光) cause to emit a flash of light
glide	v. Syn. slide; slip	(滑动,滑行) slide; move in a smooth, effortless manner
glimpse	n. Syn. glance	(一瞥,一看) glance; a quick look ; see briefly; a brief or incomplete view
glisten	v.	(闪烁,闪耀) sparkle or shine, especially shine with a mild, subdued, and fitful luster; emit a soft, scintillating light; gleam
glitter	n.	(闪闪发光,闪烁,魅力) bright, sparkling light; brilliant and showy luster; brilliancy
global	a. Syn. worldwide; international	(全球性的) worldwide; international; having the shape of a globe
globe	n.	(球,球状物,地球仪) body with the shape of a sphere, especially a representation of the earth in the form of a hollow ball
gloom	n.	(黑暗,忧郁) partial or total darkness; thick shade; obscurity; shady, gloomy, or dark place or grove; cloudiness or heaviness of mind
gloomy	a. Syn. dusky; dim	(阴暗的,没有希望的) imperfectly illuminated; dusky; dim; clouded
glorify	v. Syn. beautify	(美化,赞扬) cause to seem more splendid; beautify
glorious	a. Syn. noble; excellent; splendid	(光荣的,美丽的,灿烂的) having or deserving glory; famous; characterized by great beauty and splendor; magnificent; wonderful
glossary	n.	(词汇表) brief explanation of words, often placed at back of book
glow	v.	(炽热,发红光,鲜艳夺目) shine with an intense or white heat; give forth vivid light and heat; exhibit a strong, bright color
glue	v.	(胶,胶水,胶合,粘贴) be fixed as if by sticky substance; join or attach with or as if sticky substance
glut	v. Syn. overstock	(充斥,过量) fill beyond capacity, especially with food; swallow greedlly
gnaw	v. Syn. nibble; bite	(咬,啃) bite or chew on with the teeth
goal	n. Syn. end; objective; aim	(目标) end; objective; final purpose or aim
goat	n.	(山羊,色鬼) any of various ruminant mammals, of the genus Capra, related to the sheep; scapegoat
gorge	v.	(过量饮食) stuff oneself; overeat; make a pig of oneself
gorgeous	a. Syn. beautiful; magnificent	(华丽的,灿烂的) dazzlingly beautiful; magnificent
gossip	n. Syn. rumor	(社会新闻,小道传闻) rumor; malicious report about other people; light informal conversation for social occasions
govern	v. Syn. rule; control	(统治,管理,控制) make and administer the public policy and affairs of
governor	n.	(州长,总督) head of a state government
gown	n.	(长袍,长外衣,法官服,制服) loose, flowing upper garment; ordinary outer dress of woman; official robe of certain professional men
grab	v. Syn. grasp; snatch; capture	(攫取,抓住) take or grasp suddenly; snatch; capture
grace	n. Syn. elegance	(风度) elegance and beauty of movement or expression; short prayer of thanks before a meal
graceful	a. Syn. elegant	(优雅的) elegant; showing grace of movement, form, or proportion
gracious	a.	(亲切的,和蔼的,慈祥的) beneficent; merciful; disposed to show kindness or favor
grade	n. Syn. rank	(等级,级别,年级,成绩) step or degree in any series, rank, quality, order; relative position or standing
gradual	a.	(逐渐的,逐步的,渐进的) proceeding by steps or degrees; advancing, step by step, as in ascent or descent or from one state to another; regularly progressive
graduate	n.	((大学)毕业生,研究生) one who has received an academicals or professional degree; one who has completed the prescribed course of study
grand	a. Syn. magnificent	(宏大的,雄伟的) large and impressive in size, scope, or extent
granite	n.	(花岗岩) common, coarse-grained, light-colored, hard igneous rock consisting chiefly of quartz; unyielding endurance
grant	v.	(准予,承认,给予,授予) allow to have; give on the basis of merit; be willing to concede
graph	n. Syn. chart	(图表) chart; a drawing illustrating the relations
grasp	v. Syn. seize; grip; hold	(抓住,抓紧) grip; take hold of or seize firmly with or as if with the hand
