recession	n. Syn. withdrawal; retreat	(撤退) withdrawal; retreat; time of low economic activity
recipe	n. Syn. prescription; instruction	(食谱,处方) medical prescription; a set of directions for making or preparing something, especially food
recipient	n. Syn. receiver	(接受的东西,容纳) receiver; one that receives or is receptive
reciprocal	a. Syn. mutual; exchangeable; interacting	(互相的,互动的,互惠的) concerning each of two or more persons or things; exchangeable; interacting
recite	v.	(背诵,细述,列举) repeat, as something already prepared, written down, committed to memory; rehearse, as a lesson to an instructor
reckless	a. Syn. irresponsible; careless	(轻率的,鲁莽的) headstrong; rash; indifferent to or disregardful of consequences
reckon	v. Syn. expect; believe; suppose	(计算,估计,猜想) compute; take account of; have faith or confidence in
reclaim	v. Syn. rehabilitate; rejuvenate	(开垦,要求归还,收回) bring into or return to a suitable condition for use; claim back; make useful again
recognition	n. Syn. attention; acclaim; appreciation	(赞誉,承认) acceptance ; appreciation; approval
recognize	v. Syn. acknowledge; distinguish	(识别,辨认) perceive the identity of; consent or admit with a formal acknowledgment; show appreciation of
recollection	n. Syn. memory; remembrance	(记忆力,记性,记忆中的往事) memory; remembrance; power of recalling ideas to the mind
recommend	v. Syn. suggest	(推荐,介绍) suggest; bestow commendation on; represent favorably
recommendation	n. Syn. advice	(推荐,介绍(信)) making attractive or acceptable; pushing for something
recompense	v.	(报酬,赔偿) render an equivalent to, for service, loss; requite; remunerate; compensate; give in return; pay back
reconcile	v. Syn. adapt; settle; resolve	(抛弃前嫌,结为好友,化解冲突) correct inconsistencies; become friendly after a quarrel; become compatible or consistent
reconnaissance	n. Syn. reconnoitering	(侦查) gain information about enemy; inspection or exploration of an area
recourse	n.	(求助,求援) one that is turned or applied to for aid or security; resort for help or protection; access or admittance
recover	v. Syn. regain	(恢复,收回,取回) get or find back; regain a former condition
recreation	n.	(娱乐,消遣) amusement; entertainment
recruit	v. Syn. enlist; enroll	(征兵,征募,补充) enlist; register formally as a participant; engage for military service
rectangle	n.	(长方形) a parallelogram with four right angles
rectify	v. Syn. correct	(纠正) set right; correct by calculation or adjustment
recur	v. Syn. reappear	(重现,再来,复发) reappear; happen or occur again
recurrence	n.	(重现,反覆) act of recurring, or state of being recurrent; return
redeem	v.	(赎罪,实践(诺言)) purchase back; regain possession of by payment; ransom or rescue from captivity; pay penalty; make amends for
reed	n.	(芦苇) tall woody perennial grasses with hollow slender stems
reef	n.	(礁,暗礁) chain or range of rocks lying at or near the surface of the water
reel	n.	(绕线筒,线轴,磁带盘,卷轴) frame with radial arms, or a kind of spool, turning on axis, on which threads or lines are wound
referee	n.	(裁判员,仲裁者) someone to investigate and report on a case or to ensure fair play
reference	n.	(提及,涉及,参考,查询) act of referring or consulting; remark that calls attention to something or someone
refine	v. Syn. purify	(精炼,精制) purify; make more precise; improve
refined	a. Syn. cultured; purified	(优雅的,精制的) cultured; purified; made pure
refinement	n.	((言语,举止等的)文雅,精巧) result of improving something; process of removing impurities
reflect	v.	(反射,仔细考虑) throw or bend back light from a surface; give back or show an image of; mirror
reflection	n. Syn. expression	(反映) image of something as reflected by mirror; remark expressing careful consideration
refrain	v. Syn. resist; forbear	(抵制,抵抗,远离,节制) abstain from; resist; hold oneself back
refreshment	n.	(茶点,提神之事物) activity that refreshes and recreates; snacks and drinks served as a light meal
refrigerator	n.	(冰箱,冷藏库) machines in which food can be stored at low temperatures
refugee	n.	(逃亡者,难民) one who flees to shelter, or place of safety
refund	n.	(偿还,退款) repayment of fund; an amount repaid
refusal	n.	(拒绝,不允) act of refusing; denial of anything demanded
refute	v. Syn. disprove	(反驳) disprove; prove to be false or incorrect
regarding	ad.	(关于) with respect to; by concerning
regardless	a.	(不管,不顾,不注意) without consideration; in spite of everything; anyway
regime	n. Syn. government; administration	(政体) form of government; government in power; administration; prevailing social system or pattern
regiment	n.	((军队)团,严格控制,统治) government; mode of ruling; rule; authority
region	n.	(地区,地域) province; district; tract; neighborhood; the upper air; sky or heavens; inhabitants of a district
register	v. Syn. record	(登记) give outward signs of; express; record in writing; enroll as a student
regulate	v. Syn. direct	(管制,控制) bring into conformity with rules or principles or usage; impose regulations; fix or adjust the time, amount, degree, or rate of
regulation	n.	(规则,规章) act of controlling or directing according to rule; prescribed by or according to rule
rehearsal	n.	(排演,排练) act of rehearsing; exercise or practice to prepare for a public performance
rehearse	v. Syn. practice; drill	(预演,排练) practice; drill; engage in preparation for a public performance
reign	n. Syn. sovereignty; rule; control	(统治,支配) sovereignty; rule; dominance or widespread influence
reimburse	v. Syn. repay; refund; indemnify	(偿还) pay back for some expense incurred
rein	n.	(缰绳,控制) strap or rope attached to the bridle or bit, used to control a horse or other animal; instrument or means of curbing, restraining, or governing
reinforce	v. Syn. strengthen; enhance	(加强) give more force or effectiveness to; strengthen; enhance
reiterate	v.	(重申,重复) say, state, or perform again or repeatedly
reject	v. Syn. refuse; deny	(拒绝,抵制) turn down; refuse to accept; dismiss from consideration
rejection	n.	(拒绝) act of rejecting something
rejoice	v.	(喜欢,高兴) feel joy; experience gladness in a high degree; have pleasurable satisfaction; be delighted; enjoy
relax	v. Syn. free; loosen; calm	((使)松弛,放松) make less severe or strict; become less tense
relaxation	n.	(松弛,缓和) state of refreshing tranquility; act of making less strict
relay	n.	(分程传递,传播) act of passing something along from one person, group, or station to another
release	v. Syn. liberate; freedom	(释放) give off; liberate; grant freedom to; make something available
relevant	a. Syn. pertinent	(有关的,相对的) pertinent; having connection with matter at hand
reliability	n.	(可靠性) trait of being dependable or reliable
reliable	a. Syn. dependable; trustworthy	(可靠的,可信赖的) worthy of being depended on; trustworthy
reliance	n.	(依靠,依靠的人或物) dependence; certainty based on past experience
relief	n.	(解脱的感觉,使人愉快的变化,调剂) easing of burden or distress, such as pain or anxiety; release from post or duty; pleasant or amusing change
relieve	v. Syn. assuage; alleviate	(减轻) free from a burden; alleviate; save from ruin
religion	n. Syn. belief; faith	(宗教) belief in supernatural power regarded as creator and governor of the universe
religious	a. Syn. devout; pious	(信奉宗教的,虔诚的) of religion; concerned with religion; having or showing belief in and reverence for God or a deity
relinquish	v. Syn. yield; abandon; surrender; waive	(不情愿的屈服,放弃(某物)) give up something with reluctance; retire from; give up or abandon
relish	v. Syn. enjoy	(品味,享受) take keen or zestful pleasure in; enjoy the flavor of; give spice or flavor to
reluctance	n.	(不情愿,勉强) state of being reluctant; unwillingness; hesitancy in taking some action
reluctant	a. Syn. unwilling; averse	(不情愿的,勉强的) not wanting to take some action; averse
rely	v. Syn. trust; depend	(依靠,依赖,信任,信赖) rest with confidence; have confidence; depend
remainder	n.	(剩余物) remnant; something left after other parts have been taken away
remains	n.	(遗址,废墟) all that is left after other parts have been taken away, used up, or destroyed; corpse; ancient ruins or fossils
remark	n. Syn. comment; commentary	(评论,注释) expression, in speech or writing, of something remarked or noticed
remarkable	a. Syn. outstanding; extraordinary	(显著的,值得注意的) worthy of notice; extraordinary
remedy	n. Syn. drug	(药物) a medicine or therapy; ; cure; fix; repair; provide relief for
remind	v.	(提醒,使记得) recall knowledge from memory; have a recollection
reminiscence	n. Syn. recollection	(怀旧,回想) recollection; process of remembering
remit	v.	(免除,宽恕,汇款) send back; give up; surrender; resign; restore; transmit or send, especially as money in payment of a demand
remittance	n.	(汇款) transmitting money, bills, especially to a distant place, as in satisfaction of a demand, or in discharge of an obligation
remnant	n. Syn. remainder; relic	(残留物) remainder; small part or portion that remains after the main part no longer exists
remove	v.	(拿走,撤走,除去) move away from the position occupied; cause to change place; take away
renaissance	n.	(复兴,再生) revival; renewal; revival of learning and culture
render	v. Syn. deliver; provide; represent	(呈递,给予,以文字形式表现,描绘,使成为) deliver;give or make available; provide; represent in a drawing or painting
renew	v. Syn. renovate; restart	(使更新,使恢复,重新开始) renovate; make new or as if new again; restore
renewable	a.	(可更新的,可恢复的) capable of being renewed or extended
renewal	n.	(更新,复兴) act of renewing; filling again by supplying what has been used up
rent	n.	(撕,裂口) payment, usually of an amount fixed by contract
rental	n.	(租金额,租赁,出租) amount paid or collected as rent; act of renting
repeal	v. Syn. revoke; annul	(废除,撤除) revoke or annul, especially by official or formal act
repel	v. Syn. disgust; reject; refuse	(撤退,退却) force or drive back; disgust; offer resistance to; fight against
repent	v.	(懊悔,后悔) cause to feel remorse or regret; feel regret or self-reproach for
repetition	n.	(重复,循环) act of doing or performing again
replace	v.	(代替,取代) substitute; put in the place of another; switch seemingly equivalent items
replacement	n.	(代替,替换) act of replacing; substitution; person or thing that takes the place of another
replenish	v. Syn. refill; restock	(补充) fill or make complete again; add a new stock or supply to
represent	v. Syn. illustrate; depict	(代表,描绘,表现) stand for; describe or present; play a role or part
representation	n.	(表示,表现) act of representing; standing in for someone or some group and speaking with authority in their behalf
representative	n. Syn. delegate	(代表,代理人) one that represents anything; that which exhibits a likeness or similitude; agent
reproach	v. Syn. admonish	(表示失望,责备) express disapproval or disappointment; bring shame upon; disgrace
reproduce	v.	(繁殖,再生,复制) have offspring or young; duplicate; make a copy
reproduction	n.	(复制品,繁殖) act of making copies
reptile	n.	(爬行动物) cold-blooded vertebrate including tortoises turtles snakes lizards alligators crocodiles
repudiate	v. Syn. disown	(批判) disown; refuse to acknowledge; reject validity or authority of
reputable	a. Syn. respectable; honorable	(著名的,令人尊敬的) having a good reputation; honorable
reputation	n.	(名声,名誉) state of being held in high esteem; general estimation in which a person is held by the public
repute	v.	(名声) ascribe a particular fact or characteristic to; consider; suppose
request	v. Syn. demand; require	(请求,要求) express the need or desire for; ask for
require	v. Syn. demand; request	(需要,要求) insist upon having; request and expect
requisite	n.	(必须品,必要的) necessary requirement; indispensable item
rescind	v. Syn. cancel; annul; repeal	(取消) cancel; make void; repeal or annul
rescue	n. Syn. save; salvage	(援救,救援) free from harm or evil; take from legal custody by force
research	v.	(研究,探讨,研究成果) inquire into; attempt to find out in scientific manner
resemblance	n. Syn. likeness; similarity	(相似,酷肖) likeness; similarity in appearance or external or superficial details
resemble	v. Syn. be similar to; take after; look like	(像,类似) be similar to; take after; look like
resent	v. Syn. begrudge	(愤怒,怨恨) feel bitter; consider as injury or affront; be in angry
resentment	n. Syn. indignation; bitterness; displeasure	(怨恨,愤恨) indignation; deep sense of injury; strong displeasure
reserve	n.	(自我控制,疏远) lack of enthusiasm; skeptical caution; something saved for future use; self-restraint in expression
reservoir	n. Syn. receptacle	(水库,蓄水池) tank used for collecting and storing a liquid; holding pond; lake used to store water for community use
reside	v. Syn. dwell; live; inhabit	(居住) dwell; live in a place permanently or for an extended period
residence	n. Syn. dwelling; house; abode	(居住,住处) official house; large house; act of dwelling in a place
resident	n. Syn. inhabitant; dweller	(居民) one who resides in a place permanently or for an extended period; dweller
residual	a. Syn. remaining; surplus	(剩余的,残留的) remaining as a residue; surplus
resign	v. Syn. yield; surrender; abandon	(辞去(职务),听从,顺从) sign back; return by a formal act; yield to another; abandon
resignation	n.	(听从,辞职) act of resigning or giving up, as a claim, possession, or office; surrender
resist	v. Syn. withstand	(抵抗) stand up or offer resistance; refuse to comply; withstand the force of something
resistance	n.	(反抗,抵抗,抵抗力,阻力) action of opposing something that you disapprove or disagree with
resistant	a.	(抵抗的,有抵抗力的) unaffected; incapable of being affected
resolute	a. Syn. firm; determined; decided	(坚定的,毅然的) firm, unyielding, or determined; having decided purpose
resolution	n. Syn. determination; resolve	(坚定,决心,决定) determination; resolving to do something; formal statement of a decision
resolve	n. Syn. determination; resolution; decision	(决定,会议的正式文件) determination; formal expression by a meeting; agreed to by a vote
resort	n.	(旅游胜地) vacation spot; act of turning to for assistance
resource	n. Syn. materials; abilities	(资源,财力,办法,智谋) materials; abilities; available source
respect	n. Syn. honor; esteem; admire	(尊敬,敬重) honor or esteem; admire; aspect; detail or point
respective	a. Syn. individual	(分别的,各自的) individual; relating to particular persons or things, each to each; particular; respectful; regardful
respectively	ad. Syn. separately; individually	(分别地,各个地) separately; individually; in the order given
respond	v. Syn. react; answer	(回答,反应) show a reaction to something favorably or as hoped
responsibility	n. Syn. duties; obligation	(责任,职责) duties; obligation; state of being responsible, accountable, or answerable
responsible	a. Syn. accountable	(有责任的) accountable; held accountable
restless	a.	(不安宁的,好动的) never resting; unquiet; uneasy; continually moving; eager for change; discontented
restore	v. Syn. reinstate; renovate; renew	(使恢复,整修,修复) give or bring back; return to its original condition
restrain	v. Syn. inhibit; stop; repress	(克制,抑制) keep under control; hold back ; place limits on
restraint	n. Syn. restriction; limitation	(抑制,控制) moderation or limitation; controlling force; loss of freedom; control of feelings
restrict	v. Syn. limit; inhibit; confine	(限制,约束) keep or confine within limits
restriction	n.	(限制,约束) act of keeping something within specified bounds; a principle that limits the extent of something
restrictive	a. Syn. limiting; confining	(限制性的) tending or serving to restrict; limiting; confining
resume	v.	(重新开始,继续) give a summary; return to a previous location or condition
retail	a.	(零售的) selling of goods to consumers
retailer	n.	(零售商) company which sells goods
retain	v. Syn. keep; employ	(保持,使用) keep; maintain possession of; hire by payment of a fee; keep in mind; remember
retire	v.	(退休,引退) move back and away from; stop performing one's work or withdraw from one's position
retirement	n.	(退休) period of your life after you have stopped work at a certain age
retort	n.	(反驳) reply, especially to answer in a quick, caustic, or witty manner
retreat	n. Syn. receding	(消退,退却) receding; pull back or move away or backward; withdrawal of troops to a more favorable position
retroactive	a.	(追溯的（由制定之日前的某一天生效）) extending in scope or effect to a prior time or to prior conditions
reveal	v. Syn. expose; uncover	(展现,揭露) make known; disclose or show
revenge	v. Syn. avenge	(报复,报仇) do punishment in return for injury or insult; avenge
revenue	n. Syn. income; reward	(收入,国家的税收) money which returns from an investment; annual income; reward
reverence	n.	(崇敬,敬礼) profound respect and esteem with fear and affection, as for a holy being or place; act showing respect, especially a bow or curtsy
reverse	v. Syn. back; rear	(背面) overturn; turn inside out or upside down; turning in the opposite direction
revert	v. Syn. relapse; backslide; return	(回复,故态复萌) return to a former condition, practice, subject, or belief; backslide; turn back to
review	n.	(回顾,再检查,检阅) summary of a longer discussion; formal examination; practice to refresh memory
revise	v. Syn. amend; change	(修改,修订) amend; change
revision	n. Syn. modification; correction	(修订,校订) modification; correction; act of altering
revival	n. Syn. resuscitation; resurgence	(复兴,复活) bringing again into activity and prominence
revive	v. Syn. resuscitate; recover; renew	(使复活,使振奋) restore from a depressed; renew
revoke	v. Syn. cancel; retract; void; annul	(撤回,取消) void or annul by recalling, withdrawing, or reversing; cancel; retract
revolt	v. Syn. resist; rebel	(反抗,起义,反叛) organize opposition to authority; make revolution
revolution	n.	(革命) act of revolving; motion of body round a fixed point or line; rotation; total or radical change; fundamental change in political organization
revolutionary	a.	(革命的) marked by new or introducing radical change
revolve	v.	(绕转,旋转,考虑,细想) turn or roll round on, or as on, an axis, like a wheel; rotate; move in curved path round a center; pass in cycles
reward	n.	(酬谢,酬劳,报答) satisfying return or result; profit, return for performance of a desired behavior; positive reinforcement.
rhythm	n. Syn. pattern; beat; tempo	(节奏,韵律) pattern; beat; recurring at regular intervals
rib	n.	(肋骨,伞骨) one of the curved bones attached to the vertebral column and supporting the lateral walls of the thorax
ribbon	n.	(带,缎带,丝带,勋章的绶带) fillet or narrow woven fabric, commonly of silk; narrow strip of fine material used for trimming
riddle	v. Syn. permeate; spread	(刺出无数窟窿,充斥,弥漫,谜语,解谜) pierce with numerous holes; perforate; permeate or spread throughout
ridge	n.	(脊,山脊) long, narrow upper section or crest; chain of hills or mountains
ridicule	n. Syn. mock	(嘲笑) words or actions intended to evoke contemptuous laughter; make fun of
ridiculous	a. Syn. foolish	(荒唐的,可笑的) completely lacking of wisdom or good sense
rifle	n.	(来复枪,步枪) shoulder firearm with a long barrel
righteous	a.	(正直的,合法的,正当的,公正的) morally justified; equitable; free from wrong, guilt, or sin
rigid	a. Syn. stiff; strict	(刚硬的,不屈的) stiff and unyielding; strict; hard and unbending; not flexible
rigidity	n. Syn. stiffness	(僵化,死板) stiffness; physical property of being stiff and resisting bending
rigor	n. Syn. severity	(严格,苛刻,精确) strictness or severity, as in temperament, action, or judgment; something hard to endure
rigorous	a. Syn. severe; harsh; exact	(严峻的,严格的,严厉的) full of rigors; harsh; rigidly accurate; precise
rim	n.	(边,缘,框架,轮缘) border, edge, or margin of a thing, usually of something circular or curving
rinse	v. Syn. flush	(用清水冲洗,漱) cleanse with water; flush; wash lightly without soap
riot	n. Syn. commotion; rebellion	(暴动,骚乱) state of disorder involving group violence; rebellion
rip	v. Syn. tear; rend	(撕,撕裂) tear or be torn violently; criticize or abuse strongly and violently
ripe	a. Syn. ready; mature	(熟的,成熟的) ready; fully developed; mature
ripen	v.	((使)成熟) grow ripe; cause to ripen or develop fully
ripple	n.	(微波,涟漪,起涟漪) wavelike motion; undulation; sound like that of water running over a stony bottom
rise	v. Syn. ascend	(升起,升高,起床) move from a lower position to a higher; mount up; move upward; reach a higher level
risky	a. Syn. hazardous; dangerous	(危险的,冒险的) involving risk or danger; hazardous
rival	v. Syn. compete	(比得上,并驾齐驱) compete; be equal to in quality or ability; match
rivalry	n. Syn. competition; contest	(竞争,敌对状态) competition; the act of competing as for profit or a prize
roam	v. Syn. wander; ramble; stroll	(漫游,漫步) wander; ramble; stroll
roar	n. Syn. bellow; rumble	(吼,轰鸣) bellow; rumble; make a loud noise
roast	v. Syn. bake; toast	(烤,烘) cook with dry heat, usually in an oven; subject to laughter or ridicule
robe	n.	(长袍,礼服) outer garment; dress of rich, flowing, and elegant style or make; dress of state, rank, office
robust	a. Syn. vigorous; strong; healthy	(健壮的) vigorous; full of health and strength; vigorous
rod	n. Syn. stick; shaft	(杆,枝) stick; a long thin implement made of metal or wood
role	n. Syn. part; function	(角色,任务) normal activity of a person in particular social setting; part played by a performer
roll	n.	(滚动) a list of names
rooster	n.	(公鸡) adult male chicken
rot	v. Syn. decay	(腐烂,枯朽,弄坏,毁坏) become decomposed by a natural process; perish slowly; become corrupt
rotary	a.	(旋转的,转动的) turning, as a wheel on its axis; pertaining to, or resembling, the motion of a wheel on its axis
rotate	v. Syn. alternate	(轮流) plant or grow in a fixed cyclic order of succession; swirl; revolve; turn on or around an axis or a center
rotation	n. Syn. revolution	(旋转) revolution; act of rotating as if on an axis
rough	a. Syn. coarse; harsh	(粗糙的,不平的) not perfected; having or caused by an irregular surface
roughly	ad. Syn. approximately; more or less	(概略地,大致地) approximately; more or less
round	ad.	(圆的,圆形的,球形的,弧形的) by moving in or forming a circle; from beginning to end; throughout; to a specific place or person
roundabout	a.	(绕远道的,转弯抹角的) circuitous; going round; indirect; encircling; enveloping; comprehensive
rouse	v.	(叫起,唤醒,激发,激怒) become active; excite, as to anger or action; stir up; awaken
route	n. Syn. way	(路,路线,(经由某一路线)发送) way for travel or transportation
routine	n. Syn. convention; habit; custom	(常规,惯例) unvarying or habitual method of procedure; occurring at fixed times or predictable intervals
royalty	n.	(皇室,版税(付给著作人的钱)) being royal; quality of royal person; kingship; sovereignty; share of product, as a percentage paid to owner of copyright
rub	v. Syn. graze; chafe	(擦,揩拭,摩擦) move over the surface with pressure and friction; spread a substance thinly over
ruin	v. Syn. destroy; devastate; exterminate	(破坏,毁灭) fall or tumble down; destroy; devastate; exterminate
ruinous	a.	(导致毁灭的,使人破产的) causing, or tending to cause ruin; destructive; baneful; pernicious
rule	n. Syn. regulation; prescription	(规则,法规,规定,章程) governing direction for a specific purpose; regulation; systematic method
rural	a. Syn. country; rustic	(农村的,乡下的,田园的) country; relating to rural areas
rust	v.	(锈,生锈) become destroyed by water, air, or an etching chemical such as an acid
ruthless	a. Syn. pitiless; cruel	(无情的) pitiless; cruel; having no compassion or pity; merciless
sack	n.	(大袋,麻布袋) bag made of paper or plastic for holding customer's purchases; enclosed space
sacred	a. Syn. divine; consecrated; holy	(宗教的,祭祀的) concerned with religion; worthy of respect or dedication
sacrifice	n.	(供奉,祭祀,祭品,牺牲) offering of something to god; victim offered to god; surrender or loss of profit for higher object
saddle	v.	(鞍子,马鞍) load or burden; put harness onto animal's back to ride
sag	v.	(下陷,下垂,消沉) sink, in the middle, by its weight or under applied pressure, below a horizontal line or plane
sake	n. Syn. purpose	(缘故,原因) purpose; reason for wanting something done
salmon	n.	(鲑鱼) several species of fish of the Salmonidae family; reddish yellow or orange color, like the flesh of the salmon
salute	n. Syn. honor	(行举手礼,欢迎,祝贺) give a sign of good will; compliment by an act or ceremony, as a kiss, a bow; honor
sample	n. Syn. specimen; example	(范例,样品) small part of something intended as representative of the whole
sandy	a.	(沙的,多沙的) loose and large-grained in consistency
